{
  "$schema": "https://json-schema.org/draft/2020-12/schema",
  "$id": "https://metal-llm-lab.dev/schemas/result.schema.json",
  "title": "Metal LLM Lab benchmark result",
  "type": "object",
  "additionalProperties": false,
  "required": ["schema_version", "experiment_id", "date", "model_id", "provenance", "runs"],
  "properties": {
    "schema_version": { "const": 1 },
    "experiment_id": { "$ref": "#/$defs/id" },
    "date": { "type": "string", "format": "date" },
    "model_id": { "$ref": "#/$defs/id" },
    "suite_id": { "$ref": "#/$defs/id" },
    "benchmark_mode": { "enum": ["local", "endpoint"] },
    "provenance": { "$ref": "#/$defs/provenance" },
    "summary": {
      "type": "object",
      "additionalProperties": false,
      "required": ["output", "title"],
      "properties": {
        "output": { "type": "string", "pattern": "^[a-z0-9.-]+\\.md$" },
        "title": { "type": "string", "minLength": 1 }
      }
    },
    "environment": { "type": "object" },
    "configuration": { "type": "object" },
    "interpretation": { "type": "object" },
    "validations": { "type": "array", "items": { "type": "object" } },
    "runs": {
      "type": "array",
      "minItems": 1,
      "items": { "$ref": "#/$defs/run" }
    }
  },
  "$defs": {
    "id": {
      "type": "string",
      "pattern": "^[a-z0-9]+(?:[.-][a-z0-9]+)*$"
    },
    "git_sha": {
      "type": "string",
      "pattern": "^[0-9a-f]{40}$"
    },
    "sha256": {
      "type": "string",
      "pattern": "^[0-9a-f]{64}$"
    },
    "provenance": {
      "type": ["object", "null"],
      "additionalProperties": false,
      "required": ["repository", "hardware", "system", "profile_id", "runtime_alias", "context", "vision", "mtp_policy", "mtp_threshold", "runtime", "model_manifest_sha256", "artifacts", "suite"],
      "properties": {
        "repository": {
          "type": "object",
          "additionalProperties": false,
          "required": ["revision", "tree_sha", "clean"],
          "properties": {
            "revision": { "$ref": "#/$defs/git_sha" },
            "tree_sha": { "$ref": "#/$defs/git_sha" },
            "clean": { "const": true }
          }
        },
        "hardware": {
          "type": "object",
          "additionalProperties": false,
          "required": ["id", "chip", "unified_memory_bytes"],
          "properties": {
            "id": { "$ref": "#/$defs/id" },
            "chip": { "type": "string", "minLength": 1 },
            "unified_memory_bytes": { "type": "integer", "minimum": 1 }
          }
        },
        "system": {
          "type": "object",
          "additionalProperties": false,
          "required": ["operating_system", "operating_system_version", "compiler", "sdk", "power_source", "low_power_mode"],
          "properties": {
            "operating_system": { "const": "macOS" },
            "operating_system_version": { "type": ["string", "null"], "minLength": 1 },
            "compiler": { "type": ["string", "null"], "minLength": 1 },
            "sdk": { "type": ["string", "null"], "minLength": 1 },
            "power_source": { "type": ["string", "null"], "minLength": 1 },
            "low_power_mode": { "type": ["boolean", "null"] }
          }
        },
        "profile_id": {
          "type": ["string", "null"],
          "pattern": "^[a-z0-9]+(?:[.-][a-z0-9]+)*$"
        },
        "runtime_alias": { "enum": ["tuned", "upstream", null] },
        "context": { "type": ["integer", "null"], "minimum": 1 },
        "vision": { "type": ["boolean", "null"] },
        "mtp_policy": { "enum": ["on", "off", "dynamic", null] },
        "mtp_threshold": { "type": ["integer", "null"], "minimum": 1 },
        "runtime": {
          "type": "object",
          "additionalProperties": false,
          "required": ["id", "tested_revision", "tested_tree_sha", "manifest_sha256", "build_receipt_sha256", "executable"],
          "properties": {
            "id": { "$ref": "#/$defs/id" },
            "tested_revision": { "$ref": "#/$defs/git_sha" },
            "tested_tree_sha": { "$ref": "#/$defs/git_sha" },
            "manifest_sha256": { "$ref": "#/$defs/sha256" },
            "build_receipt_sha256": { "$ref": "#/$defs/sha256" },
            "executable": {
              "type": "object",
              "additionalProperties": false,
              "required": ["name", "sha256"],
              "properties": {
                "name": { "enum": ["llama-server", "llama-bench"] },
                "sha256": { "$ref": "#/$defs/sha256" }
              }
            }
          }
        },
        "model_manifest_sha256": { "$ref": "#/$defs/sha256" },
        "artifacts": {
          "type": "array",
          "minItems": 1,
          "items": {
            "type": "object",
            "additionalProperties": false,
            "required": ["id", "bytes", "sha256"],
            "properties": {
              "id": { "$ref": "#/$defs/id" },
              "bytes": { "type": "integer", "minimum": 1 },
              "sha256": { "$ref": "#/$defs/sha256" }
            }
          }
        },
        "suite": {
          "type": "object",
          "additionalProperties": false,
          "required": ["id", "sha256", "fixtures"],
          "properties": {
            "id": { "$ref": "#/$defs/id" },
            "sha256": { "$ref": "#/$defs/sha256" },
            "fixtures": {
              "type": "array",
              "items": {
                "type": "object",
                "additionalProperties": false,
                "required": ["path", "sha256"],
                "properties": {
                  "path": { "type": "string", "pattern": "^benchmarks/fixtures/[A-Za-z0-9][A-Za-z0-9._/-]*\\.(?:png|jpg|jpeg)$" },
                  "sha256": { "$ref": "#/$defs/sha256" }
                }
              }
            }
          }
        }
      }
    },
    "run": {
      "type": "object",
      "additionalProperties": false,
      "required": [
        "id",
        "experiment",
        "measurement_kind",
        "timestamp",
        "repository_revision",
        "hardware_id",
        "runtime_id",
        "runtime_revision",
        "profile",
        "profile_id",
        "runtime_alias",
        "context",
        "vision",
        "mtp_policy",
        "mtp_selected",
        "mtp_threshold",
        "prompt_tokens",
        "effective_prompt_tokens",
        "generated_tokens",
        "prompt_tokens_per_second",
        "generation_tokens_per_second",
        "generation_settings",
        "command",
        "notes"
      ],
      "properties": {
        "id": { "$ref": "#/$defs/id" },
        "experiment": { "$ref": "#/$defs/id" },
        "measurement_kind": {
          "enum": ["single_run", "three_run_mean"]
        },
        "timestamp": {
          "type": "string",
          "format": "date-time",
          "pattern": "^[0-9]{4}-[0-9]{2}-[0-9]{2}T[0-9]{2}:[0-9]{2}:[0-9]{2}Z$"
        },
        "repository_revision": { "$ref": "#/$defs/git_sha" },
        "hardware_id": { "$ref": "#/$defs/id" },
        "runtime_id": { "$ref": "#/$defs/id" },
        "runtime_revision": { "$ref": "#/$defs/git_sha" },
        "profile": {
          "type": ["string", "null"],
          "pattern": "^[a-z0-9]+(?:[.-][a-z0-9]+)*$"
        },
        "profile_id": {
          "type": ["string", "null"],
          "pattern": "^[a-z0-9]+(?:[.-][a-z0-9]+)*$"
        },
        "runtime_alias": { "enum": ["tuned", "upstream", null] },
        "context": { "type": ["integer", "null"], "minimum": 1 },
        "mtp_policy": { "enum": ["on", "off", "dynamic", null] },
        "mtp_selected": { "type": ["boolean", "null"] },
        "mtp_threshold": { "type": ["integer", "null"], "minimum": 1 },
        "prompt_tokens": { "type": ["integer", "null"], "minimum": 0 },
        "effective_prompt_tokens": { "type": ["integer", "null"], "minimum": 0 },
        "generated_tokens": { "type": ["integer", "null"], "minimum": 0 },
        "prompt_tokens_per_second": { "type": ["number", "null"], "minimum": 0 },
        "generation_tokens_per_second": { "type": ["number", "null"], "minimum": 0 },
        "prompt_tokens_per_second_display": { "type": "string", "pattern": "^[0-9]+(?:,[0-9]{3})*(?:\\.[0-9]+)?$" },
        "generation_tokens_per_second_display": { "type": "string", "pattern": "^[0-9]+(?:,[0-9]{3})*(?:\\.[0-9]+)?$" },
        "prompt_tokens_per_second_sd": { "type": "number", "minimum": 0 },
        "generation_tokens_per_second_sd": { "type": "number", "minimum": 0 },
        "generation_tokens_per_second_sd_display": { "type": "string", "pattern": "^[0-9]+(?:\\.[0-9]+)?$" },
        "change_display": { "type": "string", "pattern": "^[+-][0-9]+(?:\\.[0-9]+)?%$" },
        "cache_depth": { "type": "integer", "minimum": 0 },
        "vision": { "type": ["boolean", "null"] },
        "mtp": { "type": "boolean" },
        "draft_acceptance": { "type": "string", "pattern": "^[0-9]+/[0-9]+$" },
        "output_sha256": { "$ref": "#/$defs/sha256" },
        "output_equivalence": { "enum": ["byte_identical", "diverged", "not_compared"] },
        "command": {
          "type": ["array", "null"],
          "minItems": 1,
          "items": { "type": "string" }
        },
        "generation_settings": {
          "type": "object",
          "additionalProperties": false,
          "required": ["temperature", "seed", "max_tokens"],
          "properties": {
            "temperature": { "type": "number" },
            "seed": { "type": "integer" },
            "max_tokens": { "type": "integer", "minimum": 0 },
            "reasoning": { "type": "boolean" },
            "repetitions": { "type": "integer", "minimum": 1 },
            "draft_n_max": { "type": "integer", "minimum": 1 }
          }
        },
        "notes": { "type": "string", "minLength": 1 }
      }
    }
  }
}
